{"$schema":"https://json-schema.org/draft/2020-12/schema","type":"object","properties":{"version":{"type":"string","const":"v1"},"license":{"type":"string","const":"CC BY 4.0"},"updated":{"type":"string","pattern":"^\\d{4}-\\d{2}-\\d{2}$"},"docs":{"type":"string","format":"uri"},"lists":{"type":"array","items":{"type":"object","properties":{"id":{"type":"string"},"title":{"type":"string"},"url":{"type":"string","format":"uri"},"page":{"type":"string","format":"uri"},"projects":{"type":"integer","minimum":0,"maximum":9007199254740991},"categories":{"type":"array","items":{"type":"object","properties":{"id":{"type":"string"},"title":{"type":"string"},"url":{"type":"string","format":"uri"},"projects":{"type":"integer","minimum":-9007199254740991,"maximum":9007199254740991}},"required":["id","title","url","projects"],"additionalProperties":false}}},"required":["id","title","url","page","projects","categories"],"additionalProperties":false}},"alternatives":{"type":"array","items":{"type":"object","properties":{"product":{"type":"string"},"url":{"type":"string","format":"uri"}},"required":["product","url"],"additionalProperties":false}}},"required":["version","license","updated","docs","lists","alternatives"],"additionalProperties":false}