{"version":"v1","license":"CC BY 4.0","updated":"2026-10-14","docs":"https://archestack.com/api/","lists":[{"id":"best-of-vibe-coding","title":"Best of Vibe Coding","url":"https://archestack.com/api/v1/lists/best-of-vibe-coding.json","page":"https://archestack.com/best-of-vibe-coding/","projects":191,"categories":[{"id":"chat-apps","title":"Chat apps","url":"https://archestack.com/api/v1/categories/best-of-vibe-coding/chat-apps.json","projects":12},{"id":"rag-search","title":"RAG and search","url":"https://archestack.com/api/v1/categories/best-of-vibe-coding/rag-search.json","projects":12},{"id":"agents","title":"Agent backends","url":"https://archestack.com/api/v1/categories/best-of-vibe-coding/agents.json","projects":18},{"id":"agent-ui","title":"Agent UI and generative UI","url":"https://archestack.com/api/v1/categories/best-of-vibe-coding/agent-ui.json","projects":6},{"id":"voice-realtime","title":"Voice and realtime","url":"https://archestack.com/api/v1/categories/best-of-vibe-coding/voice-realtime.json","projects":16},{"id":"mcp-apps","title":"MCP servers and chat-host apps","url":"https://archestack.com/api/v1/categories/best-of-vibe-coding/mcp-apps.json","projects":5},{"id":"saas-with-ai","title":"SaaS boilerplates","url":"https://archestack.com/api/v1/categories/best-of-vibe-coding/saas-with-ai.json","projects":7},{"id":"app-builders","title":"App builder starters","url":"https://archestack.com/api/v1/categories/best-of-vibe-coding/app-builders.json","projects":8},{"id":"editors-workflows","title":"AI editors and workflow canvases","url":"https://archestack.com/api/v1/categories/best-of-vibe-coding/editors-workflows.json","projects":4},{"id":"cloud-reference","title":"Cloud reference architectures","url":"https://archestack.com/api/v1/categories/best-of-vibe-coding/cloud-reference.json","projects":7},{"id":"api-backends","title":"AI API backends","url":"https://archestack.com/api/v1/categories/best-of-vibe-coding/api-backends.json","projects":6},{"id":"mobile-extensions","title":"Mobile and browser extensions","url":"https://archestack.com/api/v1/categories/best-of-vibe-coding/mobile-extensions.json","projects":2},{"id":"coding-agents","title":"Coding agents and assistants","url":"https://archestack.com/api/v1/categories/best-of-vibe-coding/coding-agents.json","projects":29},{"id":"skills-plugins","title":"Skills, plugins and rules","url":"https://archestack.com/api/v1/categories/best-of-vibe-coding/skills-plugins.json","projects":43},{"id":"dev-mcp","title":"MCP servers for developers","url":"https://archestack.com/api/v1/categories/best-of-vibe-coding/dev-mcp.json","projects":9},{"id":"code-review","title":"Code review and testing","url":"https://archestack.com/api/v1/categories/best-of-vibe-coding/code-review.json","projects":1},{"id":"design-to-code","title":"Design to code","url":"https://archestack.com/api/v1/categories/best-of-vibe-coding/design-to-code.json","projects":2},{"id":"backends","title":"Backends and databases","url":"https://archestack.com/api/v1/categories/best-of-vibe-coding/backends.json","projects":2},{"id":"deploy","title":"Deploy and hosting","url":"https://archestack.com/api/v1/categories/best-of-vibe-coding/deploy.json","projects":2}]},{"id":"best-of-ai","title":"Best of Open-Source AI","url":"https://archestack.com/api/v1/lists/best-of-ai.json","page":"https://archestack.com/best-of-ai/","projects":206,"categories":[{"id":"assistants","title":"Assistants","url":"https://archestack.com/api/v1/categories/best-of-ai/assistants.json","projects":12},{"id":"chat-ui","title":"Chat UIs","url":"https://archestack.com/api/v1/categories/best-of-ai/chat-ui.json","projects":14},{"id":"desktop-apps","title":"Desktop AI apps","url":"https://archestack.com/api/v1/categories/best-of-ai/desktop-apps.json","projects":4},{"id":"agent-platforms","title":"Agent platforms","url":"https://archestack.com/api/v1/categories/best-of-ai/agent-platforms.json","projects":10},{"id":"automation","title":"Workflow automation with AI","url":"https://archestack.com/api/v1/categories/best-of-ai/automation.json","projects":2},{"id":"rag-knowledge","title":"RAG and knowledge","url":"https://archestack.com/api/v1/categories/best-of-ai/rag-knowledge.json","projects":17},{"id":"search","title":"Search","url":"https://archestack.com/api/v1/categories/best-of-ai/search.json","projects":5},{"id":"voice","title":"Voice","url":"https://archestack.com/api/v1/categories/best-of-ai/voice.json","projects":15},{"id":"image-video","title":"Image and video","url":"https://archestack.com/api/v1/categories/best-of-ai/image-video.json","projects":10},{"id":"security","title":"Security","url":"https://archestack.com/api/v1/categories/best-of-ai/security.json","projects":1},{"id":"agent-frameworks","title":"Agent frameworks and SDKs","url":"https://archestack.com/api/v1/categories/best-of-ai/agent-frameworks.json","projects":9},{"id":"memory","title":"Memory","url":"https://archestack.com/api/v1/categories/best-of-ai/memory.json","projects":12},{"id":"model-serving","title":"Model serving","url":"https://archestack.com/api/v1/categories/best-of-ai/model-serving.json","projects":22},{"id":"training","title":"Training and fine-tuning","url":"https://archestack.com/api/v1/categories/best-of-ai/training.json","projects":5},{"id":"ml-frameworks","title":"ML frameworks and libraries","url":"https://archestack.com/api/v1/categories/best-of-ai/ml-frameworks.json","projects":9},{"id":"gateways","title":"Gateways","url":"https://archestack.com/api/v1/categories/best-of-ai/gateways.json","projects":14},{"id":"observability","title":"Observability","url":"https://archestack.com/api/v1/categories/best-of-ai/observability.json","projects":13},{"id":"vector-db","title":"Vector databases","url":"https://archestack.com/api/v1/categories/best-of-ai/vector-db.json","projects":8},{"id":"sandboxes","title":"Sandboxes","url":"https://archestack.com/api/v1/categories/best-of-ai/sandboxes.json","projects":8},{"id":"data-tools","title":"Data and scraping for AI","url":"https://archestack.com/api/v1/categories/best-of-ai/data-tools.json","projects":6},{"id":"learning","title":"Learning and cookbooks","url":"https://archestack.com/api/v1/categories/best-of-ai/learning.json","projects":10}]}],"alternatives":[{"product":"Cursor","url":"https://archestack.com/api/v1/alternatives/cursor.json"},{"product":"GitHub Copilot","url":"https://archestack.com/api/v1/alternatives/github-copilot.json"},{"product":"Claude Code","url":"https://archestack.com/api/v1/alternatives/claude-code.json"},{"product":"Devin","url":"https://archestack.com/api/v1/alternatives/devin.json"},{"product":"Tabnine","url":"https://archestack.com/api/v1/alternatives/tabnine.json"},{"product":"Lovable","url":"https://archestack.com/api/v1/alternatives/lovable.json"},{"product":"v0","url":"https://archestack.com/api/v1/alternatives/v0.json"},{"product":"Bolt.new","url":"https://archestack.com/api/v1/alternatives/bolt-new.json"},{"product":"Replit","url":"https://archestack.com/api/v1/alternatives/replit.json"},{"product":"CodeRabbit","url":"https://archestack.com/api/v1/alternatives/coderabbit.json"},{"product":"Firebase","url":"https://archestack.com/api/v1/alternatives/firebase.json"},{"product":"Vercel","url":"https://archestack.com/api/v1/alternatives/vercel.json"},{"product":"Heroku","url":"https://archestack.com/api/v1/alternatives/heroku.json"},{"product":"Vapi","url":"https://archestack.com/api/v1/alternatives/vapi.json"},{"product":"ShipFast","url":"https://archestack.com/api/v1/alternatives/shipfast.json"},{"product":"ChatGPT","url":"https://archestack.com/api/v1/alternatives/chatgpt.json"},{"product":"Manus","url":"https://archestack.com/api/v1/alternatives/manus.json"},{"product":"Perplexity","url":"https://archestack.com/api/v1/alternatives/perplexity.json"},{"product":"LM Studio","url":"https://archestack.com/api/v1/alternatives/lm-studio.json"},{"product":"Glean","url":"https://archestack.com/api/v1/alternatives/glean.json"},{"product":"Copilot Studio","url":"https://archestack.com/api/v1/alternatives/copilot-studio.json"},{"product":"NotebookLM","url":"https://archestack.com/api/v1/alternatives/notebooklm.json"},{"product":"Zapier","url":"https://archestack.com/api/v1/alternatives/zapier.json"},{"product":"OpenAI API","url":"https://archestack.com/api/v1/alternatives/openai-api.json"},{"product":"OpenRouter","url":"https://archestack.com/api/v1/alternatives/openrouter.json"},{"product":"LangSmith","url":"https://archestack.com/api/v1/alternatives/langsmith.json"},{"product":"Pinecone","url":"https://archestack.com/api/v1/alternatives/pinecone.json"},{"product":"Midjourney","url":"https://archestack.com/api/v1/alternatives/midjourney.json"},{"product":"ElevenLabs","url":"https://archestack.com/api/v1/alternatives/elevenlabs.json"},{"product":"Otter.ai","url":"https://archestack.com/api/v1/alternatives/otter-ai.json"},{"product":"Mem","url":"https://archestack.com/api/v1/alternatives/mem.json"},{"product":"Apify","url":"https://archestack.com/api/v1/alternatives/apify.json"},{"product":"LlamaParse","url":"https://archestack.com/api/v1/alternatives/llamaparse.json"}]}